{
  "$schema": "https://agent-project-os.org/schemas/handoff-v1.schema.json",
  "blocked": [],
  "completed": ["Mapped the orders@2 impact"],
  "created_at": "2026-08-14T00:25:00Z",
  "decision_refs": [],
  "evidence_refs": ["service-e2"],
  "from_actor": "agent:codex",
  "goal": "Finish consumer verification and acceptance",
  "handoff_id": "codex-to-claude",
  "in_progress": ["Consumer acceptance review"],
  "next_actions": ["Verify digest", "Accept the receipt"],
  "project_id": "service",
  "protocol_version": "1.0",
  "runtime_identity": {"client_version": "example", "model_id": "example-model-a", "runtime": "codex"},
  "to_actor": "agent:claude-code"
}
